{
  "$schema": "https://json-schema.org/draft/2020-12/schema",
  "$id": "https://raw.githubusercontent.com/WinnegansFake/WinnegansFake/main/schemas/page-annotation.schema.json",
  "title": "PageAnnotation",
  "description": "Schema defining collaborative annotations for a single page of Finnegans Wake using standard academic pagination (pages 1 through 628).",
  "type": "object",
  "additionalProperties": false,
  "required": [
    "schema_version",
    "page_number",
    "annotations"
  ],
  "properties": {
    "schema_version": {
      "type": "string",
      "pattern": "^[0-9]+\\.[0-9]+\\.[0-9]+$",
      "description": "Semantic version of the annotation schema."
    },
    "work": {
      "type": "string",
      "pattern": "^[a-z0-9-]+$",
      "description": "Unique identifier of the literary work (e.g. 'finnegans-wake', 'ulysses')."
    },
    "book": {
      "type": ["integer", "string"],
      "description": "Book number or major division identifier."
    },
    "chapter": {
      "type": ["integer", "string"],
      "description": "Chapter number within the respective book."
    },
    "part": {
      "type": ["integer", "string"],
      "description": "Part number or major division in works structured into parts."
    },
    "episode": {
      "type": ["integer", "string"],
      "description": "Episode number in works structured into episodes."
    },
    "page_number": {
      "type": "integer",
      "minimum": 1,
      "maximum": 2000,
      "description": "Pagination page number."
    },
    "annotations": {
      "type": "array",
      "description": "List of line-level or phrase-level annotations on this page.",
      "items": {
        "type": "object",
        "additionalProperties": false,
        "required": [
          "id",
          "line_number",
          "target_phrase",
          "annotation_text",
          "categories",
          "contributors"
        ],
        "properties": {
          "id": {
            "type": "string",
            "pattern": "^[0-9]{3,4}\\.[0-9]{2}-[a-zA-Z0-9_-]{2,16}$",
            "description": "Unique annotation identifier incorporating page.line and short hash/token, e.g. 001.01-a1b2."
          },
          "line_number": {
            "type": "integer",
            "minimum": 1,
            "maximum": 60,
            "description": "Line number on the page (typically 1 through 40, max 60)."
          },
          "target_phrase": {
            "type": "string",
            "minLength": 1,
            "maxLength": 150,
            "description": "Short target lemma, motif, or phrase anchor (strictly minimal for identification; no reproduction of copyrighted passages)."
          },
          "annotation_text": {
            "type": "string",
            "minLength": 10,
            "description": "Critical analysis, motif breakdown, linguistic etymology, or literary gloss."
          },
          "categories": {
            "type": "array",
            "description": "Thematic or analytical tags (e.g., etymology, motif, music, folklore, Dublin topography, front-matter).",
            "items": {
              "type": "string",
              "pattern": "^[a-z0-9-]+$"
            },
            "uniqueItems": true
          },
          "cross_references": {
            "type": "array",
            "description": "Other page and line occurrences in standard notation (e.g., ['004.18', '628.16']).",
            "items": {
              "type": "string",
              "pattern": "^[0-9]{3}\\.[0-9]{2}$"
            },
            "uniqueItems": true
          },
          "sources": {
            "type": "array",
            "description": "Scholarly source citations or references supporting the note.",
            "items": {
              "type": "string"
            }
          },
            "contributors": {
            "type": "array",
            "description": "GitHub usernames or contributor identifiers responsible for this note.",
            "minItems": 1,
            "items": {
              "type": "string",
              "pattern": "^[a-zA-Z0-9](?:[a-zA-Z0-9]|-(?=[a-zA-Z0-9])){0,38}$"
            },
            "uniqueItems": true
          },
          "work": {
            "type": "string",
            "pattern": "^[a-z0-9-]+$",
            "description": "Optional work identifier for the annotation (e.g. 'finnegans-wake', 'ulysses')."
          },
          "external_links": {
            "type": "array",
            "description": "Authoritative external scholarly links, portals, or digital facsimiles.",
            "items": {
              "type": "object",
              "required": ["title", "url"],
              "additionalProperties": false,
              "properties": {
                "title": {
                  "type": "string",
                  "minLength": 1,
                  "maxLength": 120
                },
                "url": {
                  "type": "string",
                  "pattern": "^https?://"
                },
                "source": {
                  "type": "string"
                }
              }
            }
          }
        }
      }
    }
  }
}
