{
  "schema_version": "1.0.0",
  "work": "finneganswake",
  "book": 2,
  "chapter": 3,
  "page_number": 326,
  "annotations": [
    {
      "id": "326.01-979d",
      "line_number": 1,
      "target_phrase": "hooley tabell, Horrocks",
      "annotation_text": "Page 326 opens Book 2, Chapter 3 (\"The Tavern\") during the Age of Heroes phase. This passage continues HCE behind the bar at his Chapelizod pub, the Norwegian Captain tale, the television broadcast, the twelve customers drinking and judging, featuring HCE, the Twelve Customers, Butt and Taff. The nocturnal dream-narrative layers Dublin topography, world mythology, and linguistic alchemy into polysemic prose.",
      "categories": [
        "structural",
        "narrative-strata",
        "book-2"
      ],
      "cross_references": [],
      "sources": [
        "Campbell, Joseph and Robinson, Henry Morton. A Skeleton Key to Finnegans Wake. https://archive.org/details/skeletonkeytofin00camp",
        "McHugh, Roland. Annotations to Finnegans Wake. https://archive.org/details/annotationstofin0000mchu_h5g8",
        "Gordon, John. Finnegans Wake: A Plot Summary. https://johngordonfinnegan.weebly.com",
        "JJDA: Finnegans Wake Genetic Edition. https://jjda.ie"
      ],
      "contributors": [
        "joycean-scholar",
        "open-wake-editor"
      ]
    },
    {
      "id": "326.16-5240",
      "line_number": 16,
      "target_phrase": "enscure from osion",
      "annotation_text": "Mid-page polysemic node on page 326 (\"The Tavern\"): Joyce weaves multilingual puns across 60+ languages — etymological roots from the Contemporary Literature Press lexicons (Romanian, Scandinavian, Slavic, Classical) intersect with local Dublin speech rhythms. The Age of Heroes dream-logic transforms ordinary syntax into a palimpsest of global literary and mythic references.",
      "categories": [
        "etymology",
        "polysemy",
        "linguistics"
      ],
      "cross_references": [],
      "sources": [
        "Tindall, William York. A Reader's Guide to Finnegans Wake. https://archive.org/details/readersguidetofi00tind",
        "Contemporary Literature Press: Multilingual Lexicons for FW. https://editura.mttlc.ro",
        "Atherton, James S. The Books at the Wake. https://archive.org/details/booksatwake0000athe",
        "FWEET: Multilingual concordance. https://www.fweet.org"
      ],
      "contributors": [
        "joycean-scholar",
        "open-wake-editor"
      ]
    }
  ]
}
