{
  "schema_version": "1.0.0",
  "book": 1,
  "chapter": 4,
  "page_number": 98,
  "annotations": [
    {
      "id": "098.06-da5b",
      "line_number": 6,
      "target_phrase": "hod",
      "annotation_text": "Universal archetype of the father and everyman protagonist Humphrey Chimpden Earwicker (HCE), manifested here as \"hod\". Represents the recumbent Dublin landscape with head at Howth and body stretching west to Phoenix Park.",
      "categories": [
        "hce",
        "leitmotif",
        "protagonist",
        "archetype"
      ],
      "cross_references": [
        "003.01"
      ],
      "sources": [
        "Glasheen, Adaline. Third Census of Finnegans Wake. https://archive.org/details/thirdcensusoffin0000glas",
        "McHugh, Roland. The Sigla of Finnegans Wake. https://archive.org/details/siglaoffinnegans0000mchu",
        "Ellmann, Richard. James Joyce. https://archive.org/details/jamesjoyce0000ellm",
        "James Joyce Digital Archive: Finnegans Wake Notons. https://jjda.ie"
      ],
      "contributors": [
        "joycean-scholar",
        "open-wake-editor"
      ]
    },
    {
      "id": "098.24-be47",
      "line_number": 24,
      "target_phrase": "pub",
      "annotation_text": "The Twelve Jurors / Tavern Drinkers (pub): representing the chorus of public opinion, the twelve signs of the Zodiac, the Apostles, and the customers gossiping in HCE's Chapelizod pub.",
      "categories": [
        "twelve-jurors",
        "pub-life",
        "chapelizod",
        "trial"
      ],
      "cross_references": [
        "003.01"
      ],
      "sources": [
        "Glasheen, Adaline. Third Census of Finnegans Wake. https://archive.org/details/thirdcensusoffin0000glas",
        "Campbell, Joseph and Robinson, Henry Morton. A Skeleton Key to Finnegans Wake. https://archive.org/details/skeletonkeytofin00camp"
      ],
      "contributors": [
        "joycean-scholar",
        "open-wake-editor"
      ]
    },
    {
      "id": "098.25-b70b",
      "line_number": 25,
      "target_phrase": "hod",
      "annotation_text": "Universal archetype of the father and everyman protagonist Humphrey Chimpden Earwicker (HCE), manifested here as \"hod\". Represents the recumbent Dublin landscape with head at Howth and body stretching west to Phoenix Park.",
      "categories": [
        "hce",
        "leitmotif",
        "protagonist",
        "archetype"
      ],
      "cross_references": [
        "003.01"
      ],
      "sources": [
        "Glasheen, Adaline. Third Census of Finnegans Wake. https://archive.org/details/thirdcensusoffin0000glas",
        "McHugh, Roland. The Sigla of Finnegans Wake. https://archive.org/details/siglaoffinnegans0000mchu",
        "Ellmann, Richard. James Joyce. https://archive.org/details/jamesjoyce0000ellm",
        "James Joyce Digital Archive: Finnegans Wake Notons. https://jjda.ie"
      ],
      "contributors": [
        "joycean-scholar",
        "open-wake-editor"
      ]
    }
  ]
}
