{
  "schema_version": "1.0.0",
  "work": "finneganswake",
  "book": 3,
  "chapter": 3,
  "page_number": 486,
  "annotations": [
    {
      "id": "486.19-a058",
      "line_number": 19,
      "target_phrase": "swift",
      "annotation_text": "Swiftian presence \"swift\" on page 486 (\"The Inquest of Yawn\"): the Dean of St. Patrick's Cathedral haunts this passage within the judicial inquest over the prostrate body of Yawn (Shaun), voices of the dead rising through him, HCE's final confession. His dual lovers Stella and Vanessa mirror Issy's split personalities, while his savage satire infuses the Age of Men dream with political and scatological ferocity.",
      "categories": [
        "jonathan-swift",
        "dublin-history",
        "eighteenth-century",
        "satire"
      ],
      "cross_references": [
        "140.08",
        "160.06",
        "229.01",
        "292.28"
      ],
      "sources": [
        "Swift, Jonathan. Gulliver's Travels. https://www.gutenberg.org/ebooks/829",
        "Ehrenpreis, Irvin. Swift: The Man, His Works, and the Age. https://archive.org/details/swiftmanhisworks01ehre",
        "FWEET: Swift concordance. https://www.fweet.org",
        "Ricorso.net: Jonathan Swift. https://www.ricorso.net"
      ],
      "contributors": [
        "joycean-scholar",
        "open-wake-editor"
      ]
    },
    {
      "id": "486.20-232f",
      "line_number": 20,
      "target_phrase": "initial",
      "annotation_text": "Book of Kells motif \"initial\" on page 486 (\"The Inquest of Yawn\"): Joyce equates the Wake's labyrinthine text with the 8th-century illuminated Gospel at Trinity College Dublin within the judicial inquest over the prostrate body of Yawn (Shaun), voices of the dead rising through him, HCE's final confession. During this Age of Men phase, the monastic scribe and the barnyard Hen both decode divine messages from material surfaces.",
      "categories": [
        "book-of-kells",
        "manuscript-culture",
        "celtic-art",
        "epigraphy"
      ],
      "cross_references": [
        "104.01",
        "107.08",
        "119.10",
        "122.22"
      ],
      "sources": [
        "Trinity College Dublin: The Book of Kells Online. https://digitalcollections.tcd.ie/concern/works/hm50tr726",
        "Sullivan, Sir Edward. The Book of Kells. https://www.gutenberg.org/ebooks/16436",
        "Atherton, James S. The Books at the Wake. https://archive.org/details/booksatwake0000athe",
        "FWEET: Book of Kells concordance. https://www.fweet.org"
      ],
      "contributors": [
        "joycean-scholar",
        "open-wake-editor"
      ]
    }
  ]
}
