{
  "schema_version": "1.0.0",
  "work": "finneganswake",
  "book": 2,
  "chapter": 3,
  "page_number": 373,
  "annotations": [
    {
      "id": "373.01-eb9e",
      "line_number": 1,
      "target_phrase": "Seek! number digged",
      "annotation_text": "Page 373 opens Book 2, Chapter 3 (\"The Tavern\") during the Age of Heroes phase. This passage continues HCE behind the bar at his Chapelizod pub, the Norwegian Captain tale, the television broadcast, the twelve customers drinking and judging, featuring HCE, the Twelve Customers, Butt and Taff. The nocturnal dream-narrative layers Dublin topography, world mythology, and linguistic alchemy into polysemic prose.",
      "categories": [
        "structural",
        "narrative-strata",
        "book-2"
      ],
      "cross_references": [],
      "sources": [
        "Campbell, Joseph and Robinson, Henry Morton. A Skeleton Key to Finnegans Wake. https://archive.org/details/skeletonkeytofin00camp",
        "McHugh, Roland. Annotations to Finnegans Wake. https://archive.org/details/annotationstofin0000mchu_h5g8",
        "Gordon, John. Finnegans Wake: A Plot Summary. https://johngordonfinnegan.weebly.com",
        "JJDA: Finnegans Wake Genetic Edition. https://jjda.ie"
      ],
      "contributors": [
        "joycean-scholar",
        "open-wake-editor"
      ]
    },
    {
      "id": "373.06-d758",
      "line_number": 6,
      "target_phrase": "Waves",
      "annotation_text": "Mamalujo signal \"Waves\" on page 373 (\"The Tavern\"): the Four Old Men — Matthew, Mark, Luke, John; Ulster, Munster, Leinster, Connaught — serve here as senile chroniclers and bedpost witnesses during HCE behind the bar at his Chapelizod pub, the Norwegian Captain tale, the television broadcast, the twelve customers drinking and judging. In this Age of Heroes passage, they observe and record the dream's events as squawking gulls circling overhead.",
      "categories": [
        "mamalujo",
        "four-annalists",
        "provinces-of-ireland",
        "evangelists"
      ],
      "cross_references": [
        "095.27",
        "383.01",
        "387.24",
        "398.30"
      ],
      "sources": [
        "O'Donovan, John. The Annals of the Four Masters. https://celt.ucc.ie/published/T100005A/",
        "MacCabe, Colin. James Joyce and the Revolution of the Word. https://archive.org/details/jamesjoycerevolu0000macc",
        "FWEET: Mamalujo / Four Old Men concordance. https://www.fweet.org",
        "Ricorso.net: James Joyce Critical Archive. https://www.ricorso.net"
      ],
      "contributors": [
        "joycean-scholar",
        "open-wake-editor"
      ]
    },
    {
      "id": "373.15-bf1d",
      "line_number": 15,
      "target_phrase": "puncheon. Deblinity devined.",
      "annotation_text": "Mid-page polysemic node on page 373 (\"The Tavern\"): Joyce weaves multilingual puns across 60+ languages — etymological roots from the Contemporary Literature Press lexicons (Romanian, Scandinavian, Slavic, Classical) intersect with local Dublin speech rhythms. The Age of Heroes dream-logic transforms ordinary syntax into a palimpsest of global literary and mythic references.",
      "categories": [
        "etymology",
        "polysemy",
        "linguistics"
      ],
      "cross_references": [],
      "sources": [
        "Tindall, William York. A Reader's Guide to Finnegans Wake. https://archive.org/details/readersguidetofi00tind",
        "Contemporary Literature Press: Multilingual Lexicons for FW. https://editura.mttlc.ro",
        "Atherton, James S. The Books at the Wake. https://archive.org/details/booksatwake0000athe",
        "FWEET: Multilingual concordance. https://www.fweet.org"
      ],
      "contributors": [
        "joycean-scholar",
        "open-wake-editor"
      ]
    }
  ]
}
