{
  "schema_version": "1.0.0",
  "work": "finneganswake",
  "book": 3,
  "chapter": 3,
  "page_number": 478,
  "annotations": [
    {
      "id": "478.01-6175",
      "line_number": 1,
      "target_phrase": "see. Very good",
      "annotation_text": "Page 478 opens Book 3, Chapter 3 (\"The Inquest of Yawn\") during the Age of Men phase. This passage continues the judicial inquest over the prostrate body of Yawn (Shaun), voices of the dead rising through him, HCE's final confession, featuring Yawn/Shaun, Mamalujo, HCE (voice), ALP (voice). The nocturnal dream-narrative layers Dublin topography, world mythology, and linguistic alchemy into polysemic prose.",
      "categories": [
        "structural",
        "narrative-strata",
        "book-3"
      ],
      "cross_references": [],
      "sources": [
        "Campbell, Joseph and Robinson, Henry Morton. A Skeleton Key to Finnegans Wake. https://archive.org/details/skeletonkeytofin00camp",
        "McHugh, Roland. Annotations to Finnegans Wake. https://archive.org/details/annotationstofin0000mchu_h5g8",
        "Gordon, John. Finnegans Wake: A Plot Summary. https://johngordonfinnegan.weebly.com",
        "JJDA: Finnegans Wake Genetic Edition. https://jjda.ie"
      ],
      "contributors": [
        "joycean-scholar",
        "open-wake-editor"
      ]
    },
    {
      "id": "478.14-0aed",
      "line_number": 14,
      "target_phrase": "casematter messio! Frankly.",
      "annotation_text": "Mid-page polysemic node on page 478 (\"The Inquest of Yawn\"): Joyce weaves multilingual puns across 60+ languages — etymological roots from the Contemporary Literature Press lexicons (Romanian, Scandinavian, Slavic, Classical) intersect with local Dublin speech rhythms. The Age of Men dream-logic transforms ordinary syntax into a palimpsest of global literary and mythic references.",
      "categories": [
        "etymology",
        "polysemy",
        "linguistics"
      ],
      "cross_references": [],
      "sources": [
        "Tindall, William York. A Reader's Guide to Finnegans Wake. https://archive.org/details/readersguidetofi00tind",
        "Contemporary Literature Press: Multilingual Lexicons for FW. https://editura.mttlc.ro",
        "Atherton, James S. The Books at the Wake. https://archive.org/details/booksatwake0000athe",
        "FWEET: Multilingual concordance. https://www.fweet.org"
      ],
      "contributors": [
        "joycean-scholar",
        "open-wake-editor"
      ]
    }
  ]
}
