{
  "schema_version": "1.0.0",
  "book": 3,
  "chapter": 4,
  "page_number": 577,
  "annotations": [
    {
      "id": "577.01-2b43",
      "line_number": 1,
      "target_phrase": "mandragon weak wifFeyducky,",
      "annotation_text": "Structural opening of Book 3, Chapter 4, page 577. Continues the multi-layered dream narrative depicting the nocturnal transmigration of human history and Dublin topography.",
      "categories": [
        "structural",
        "narrative-strata",
        "book-3"
      ],
      "cross_references": [
        "003.01"
      ],
      "sources": [
        "Campbell, Joseph and Robinson, Henry Morton. A Skeleton Key to Finnegans Wake. https://archive.org/details/skeletonkeytofin00camp",
        "McHugh, Roland. Annotations to Finnegans Wake. https://archive.org/details/annotationstofin0000mchu_h5g8",
        "James Joyce Digital Archive: Finnegans Wake. https://jjda.ie"
      ],
      "contributors": [
        "joycean-scholar",
        "open-wake-editor"
      ]
    },
    {
      "id": "577.07-12a1",
      "line_number": 7,
      "target_phrase": "fall",
      "annotation_text": "The theme of the cosmic and comic Fall (fall): Tim Finnegan tumbling from his ladder, Humpty Dumpty shattered from the wall, and Adam falling in Eden, awaiting whiskey-fuelled resurrection.",
      "categories": [
        "the-fall",
        "humpty-dumpty",
        "tim-finnegan",
        "resurrection"
      ],
      "cross_references": [
        "003.01"
      ],
      "sources": [
        "The Ballad of Tim Finnegan's Wake. https://en.wikipedia.org/wiki/Finnegan%27s_Wake",
        "Atherton, James S. The Books at the Wake. https://archive.org/details/booksatwake0000athe",
        "Opie, Iona and Peter. The Oxford Dictionary of Nursery Rhymes. https://archive.org/details/oxforddictionary0000unse_m4u1"
      ],
      "contributors": [
        "joycean-scholar",
        "open-wake-editor"
      ]
    },
    {
      "id": "577.16-5afb",
      "line_number": 16,
      "target_phrase": "her, that uncouple",
      "annotation_text": "Mid-page polysemic discourse on page 577: Joyce weaves multilingual puns, etymological roots, and rhythmic cadences capturing the shifting consciousness of the collective unconscious.",
      "categories": [
        "etymology",
        "polysemy",
        "linguistics"
      ],
      "cross_references": [
        "003.01"
      ],
      "sources": [
        "Tindall, William York. A Reader's Guide to Finnegans Wake. https://archive.org/details/readersguidetofi00tind",
        "Atherton, James S. The Books at the Wake. https://archive.org/details/booksatwake0000athe",
        "Fweet.org: Finnegans Wake Concordance. https://www.fweet.org"
      ],
      "contributors": [
        "joycean-scholar",
        "open-wake-editor"
      ]
    }
  ]
}
