{
  "schema_version": "1.0.0",
  "book": 3,
  "chapter": 2,
  "page_number": 470,
  "annotations": [
    {
      "id": "470.09-86fb",
      "line_number": 9,
      "target_phrase": "dream",
      "annotation_text": "The nocturnal oneiric dimension (dream): Joyce's exploration of the sleeping body, sensory deprivation, auditory distortions, and the somatic language of the collective unconscious.",
      "categories": [
        "oneiric",
        "night-mind",
        "psychoanalysis",
        "sleep"
      ],
      "cross_references": [
        "003.01"
      ],
      "sources": [
        "Bishop, John. Joyce's Book of the Dark. https://archive.org/details/joycesbookofdark0000bish",
        "Freud, Sigmund. The Interpretation of Dreams. https://www.gutenberg.org/ebooks/4349"
      ],
      "contributors": [
        "joycean-scholar",
        "open-wake-editor"
      ]
    },
    {
      "id": "470.18-91f2",
      "line_number": 18,
      "target_phrase": "Jaun",
      "annotation_text": "The eternal fraternal dialectic between opposing sons Shem the Penman (the introvert, rebel, artist) and Shaun the Post (the materialist, orator, politician), embodied in \"Jaun\".",
      "categories": [
        "twins",
        "shem-and-shaun",
        "brother-battle",
        "dialectic"
      ],
      "cross_references": [
        "003.01"
      ],
      "sources": [
        "Atherton, James S. The Books at the Wake. https://archive.org/details/booksatwake0000athe",
        "Kenner, Hugh. Dublin's Joyce. https://archive.org/details/dublinsjoyce0000kenn",
        "Norris, Margot. The Decentered Universe of Finnegans Wake. https://archive.org/details/decentereduniver0000norr"
      ],
      "contributors": [
        "joycean-scholar",
        "open-wake-editor"
      ]
    },
    {
      "id": "470.21-f216",
      "line_number": 21,
      "target_phrase": "fall",
      "annotation_text": "The theme of the cosmic and comic Fall (fall): Tim Finnegan tumbling from his ladder, Humpty Dumpty shattered from the wall, and Adam falling in Eden, awaiting whiskey-fuelled resurrection.",
      "categories": [
        "the-fall",
        "humpty-dumpty",
        "tim-finnegan",
        "resurrection"
      ],
      "cross_references": [
        "003.01"
      ],
      "sources": [
        "The Ballad of Tim Finnegan's Wake. https://en.wikipedia.org/wiki/Finnegan%27s_Wake",
        "Atherton, James S. The Books at the Wake. https://archive.org/details/booksatwake0000athe",
        "Opie, Iona and Peter. The Oxford Dictionary of Nursery Rhymes. https://archive.org/details/oxforddictionary0000unse_m4u1"
      ],
      "contributors": [
        "joycean-scholar",
        "open-wake-editor"
      ]
    }
  ]
}
