{
  "schema_version": "1.0.0",
  "work": "finneganswake",
  "book": 3,
  "chapter": 4,
  "page_number": 576,
  "annotations": [
    {
      "id": "576.01-e821",
      "line_number": 1,
      "target_phrase": "Liffey",
      "annotation_text": "ALP invocation \"Liffey\" on page 576 (\"The Bedroom Scene\"): Anna Livia Plurabelle, the mother-river personifying the Liffey, surfaces here amid HCE and ALP in bed, the children's cries, attempted sexual intercourse, domestic reality intruding on the cosmic dream. In this Age of Men (closing) passage, her feminine current of forgiveness and renewal flows through the dream landscape, carrying Dublin's history from source to sea.",
      "categories": [
        "alp",
        "river-liffey",
        "feminine-principle",
        "waters"
      ],
      "cross_references": [
        "003.01",
        "196.01",
        "198.15",
        "207.20"
      ],
      "sources": [
        "Bishop, John. Joyce's Book of the Dark. https://archive.org/details/joycesbookofdark0000bish",
        "Hart, Clive. Structure and Motif in Finnegans Wake. https://archive.org/details/structuremotifin0000hart",
        "Mink, Louis O. A Finnegans Wake Gazetteer. https://archive.org/details/finneganswakegaz0000mink",
        "FWEET: ALP / River Liffey concordance. https://www.fweet.org"
      ],
      "contributors": [
        "joycean-scholar",
        "open-wake-editor"
      ]
    },
    {
      "id": "576.08-d4c6",
      "line_number": 8,
      "target_phrase": "sleep",
      "annotation_text": "Oneiric dimension \"sleep\" on page 576 (\"The Bedroom Scene\"): the nocturnal consciousness surfaces within HCE and ALP in bed, the children's cries, attempted sexual intercourse, domestic reality intruding on the cosmic dream. During this Age of Men (closing) phase, Joyce reconstructs the sleeping body's sensory deprivation — dimmed sight, distorted hearing, dream-logic association — transforming somatic experience into polyphonic language.",
      "categories": [
        "oneiric",
        "night-mind",
        "psychoanalysis",
        "sleep"
      ],
      "cross_references": [
        "003.01",
        "075.01",
        "219.01",
        "403.01"
      ],
      "sources": [
        "Bishop, John. Joyce's Book of the Dark. https://archive.org/details/joycesbookofdark0000bish",
        "Freud, Sigmund. The Interpretation of Dreams. https://www.gutenberg.org/ebooks/4349",
        "Troy, Mark L. Mummeries of Resurrection. http://www.rosenlake.net",
        "FWEET: Dream/Sleep concordance. https://www.fweet.org"
      ],
      "contributors": [
        "joycean-scholar",
        "open-wake-editor"
      ]
    },
    {
      "id": "576.12-f0c0",
      "line_number": 12,
      "target_phrase": "builder",
      "annotation_text": "HCE manifestation \"builder\" on page 576 within \"The Bedroom Scene\": here the universal father-figure Humphrey Chimpden Earwicker appears in the context of HCE and ALP in bed, the children's cries, attempted sexual intercourse, domestic reality intruding on the cosmic dream. During this Age of Men (closing) phase, HCE embodies the patriarch whose guilt, grandeur, and fall drive the cyclical dream forward.",
      "categories": [
        "hce",
        "leitmotif",
        "protagonist",
        "archetype"
      ],
      "cross_references": [
        "003.16",
        "030.01",
        "033.24",
        "075.12"
      ],
      "sources": [
        "Glasheen, Adaline. Third Census of Finnegans Wake. https://archive.org/details/thirdcensusoffin0000glas",
        "McHugh, Roland. The Sigla of Finnegans Wake. https://archive.org/details/siglaoffinnegans0000mchu",
        "FWEET: HCE concordance entries. https://www.fweet.org",
        "James Joyce Digital Archive: Finnegans Wake Notons. https://jjda.ie"
      ],
      "contributors": [
        "joycean-scholar",
        "open-wake-editor"
      ]
    }
  ]
}
