{
  "schema_version": "1.0.0",
  "work": "finneganswake",
  "book": 1,
  "chapter": 6,
  "page_number": 166,
  "annotations": [
    {
      "id": "166.01-e9b2",
      "line_number": 1,
      "target_phrase": "true crust even",
      "annotation_text": "Page 166 opens Book 1, Chapter 6 (\"The Quiz Chapter\") during the Age of Gods phase. This passage continues twelve questions and answers probing HCE's identity, the Mookse and the Gripes parable, Professor Jones, featuring Shem, Shaun, Professor Jones, the Mookse, the Gripes. The nocturnal dream-narrative layers Dublin topography, world mythology, and linguistic alchemy into polysemic prose.",
      "categories": [
        "structural",
        "narrative-strata",
        "book-1"
      ],
      "cross_references": [],
      "sources": [
        "Campbell, Joseph and Robinson, Henry Morton. A Skeleton Key to Finnegans Wake. https://archive.org/details/skeletonkeytofin00camp",
        "McHugh, Roland. Annotations to Finnegans Wake. https://archive.org/details/annotationstofin0000mchu_h5g8",
        "Gordon, John. Finnegans Wake: A Plot Summary. https://johngordonfinnegan.weebly.com",
        "JJDA: Finnegans Wake Genetic Edition. https://jjda.ie"
      ],
      "contributors": [
        "joycean-scholar",
        "open-wake-editor"
      ]
    },
    {
      "id": "166.16-39e3",
      "line_number": 16,
      "target_phrase": "make waters worse.",
      "annotation_text": "Mid-page polysemic node on page 166 (\"The Quiz Chapter\"): Joyce weaves multilingual puns across 60+ languages — etymological roots from the Contemporary Literature Press lexicons (Romanian, Scandinavian, Slavic, Classical) intersect with local Dublin speech rhythms. The Age of Gods dream-logic transforms ordinary syntax into a palimpsest of global literary and mythic references.",
      "categories": [
        "etymology",
        "polysemy",
        "linguistics"
      ],
      "cross_references": [],
      "sources": [
        "Tindall, William York. A Reader's Guide to Finnegans Wake. https://archive.org/details/readersguidetofi00tind",
        "Contemporary Literature Press: Multilingual Lexicons for FW. https://editura.mttlc.ro",
        "Atherton, James S. The Books at the Wake. https://archive.org/details/booksatwake0000athe",
        "FWEET: Multilingual concordance. https://www.fweet.org"
      ],
      "contributors": [
        "joycean-scholar",
        "open-wake-editor"
      ]
    }
  ]
}
