{
  "schema_version": "1.0.0",
  "work": "finneganswake",
  "book": 2,
  "chapter": 4,
  "page_number": 385,
  "annotations": [
    {
      "id": "385.05-5cc0",
      "line_number": 5,
      "target_phrase": "chorus of seabirds",
      "annotation_text": "Marine bird catalogue (385.05): terns, gulls, cormorants, and capercallzies squawking in cacophony above the waves, acting as a noisy Greek chorus celebrating the lovers' illicit kiss.",
      "categories": [
        "birds",
        "ornithology",
        "chorus",
        "acoustics"
      ],
      "cross_references": [
        "384.01",
        "385.15"
      ],
      "sources": [
        "Gordon, John. Finnegans Wake: A Plot Summary. https://johngordonfinnegan.weebly.com"
      ],
      "contributors": [
        "joycean-scholar",
        "open-wake-editor"
      ]
    },
    {
      "id": "385.15-aff1",
      "line_number": 15,
      "target_phrase": "Wagnerian Liebestod",
      "annotation_text": "Wagnerian parody (385.15): allusions to Richard Wagner's opera 'Tristan und Isolde', parodying the chromatic Tristan chord, the magic love potion, and the tragic love-death (Liebestod).",
      "categories": [
        "wagner",
        "opera",
        "liebestod",
        "music"
      ],
      "cross_references": [
        "383.01",
        "385.05"
      ],
      "sources": [
        "Atherton, James S. The Books at the Wake. https://archive.org/details/booksatwake0000athe"
      ],
      "contributors": [
        "joycean-scholar",
        "open-wake-editor"
      ]
    },
    {
      "id": "385.24-7dbe",
      "line_number": 24,
      "target_phrase": "night",
      "annotation_text": "Oneiric dimension \"night\" on page 385 (\"Tristan and Isolde\"): the nocturnal consciousness surfaces within the voyage of Tristan and Isolde observed by the Four Old Men as seagulls, Wagnerian chromatic motifs, King Mark's displacement. During this Age of Heroes (closing) phase, Joyce reconstructs the sleeping body's sensory deprivation — dimmed sight, distorted hearing, dream-logic association — transforming somatic experience into polyphonic language.",
      "categories": [
        "oneiric",
        "night-mind",
        "psychoanalysis",
        "sleep"
      ],
      "cross_references": [
        "003.01",
        "075.01",
        "219.01",
        "403.01"
      ],
      "sources": [
        "Bishop, John. Joyce's Book of the Dark. https://archive.org/details/joycesbookofdark0000bish",
        "Freud, Sigmund. The Interpretation of Dreams. https://www.gutenberg.org/ebooks/4349",
        "Troy, Mark L. Mummeries of Resurrection. http://www.rosenlake.net",
        "FWEET: Dream/Sleep concordance. https://www.fweet.org"
      ],
      "contributors": [
        "joycean-scholar",
        "open-wake-editor"
      ]
    },
    {
      "id": "385.25-c366",
      "line_number": 25,
      "target_phrase": "Children of Lir",
      "annotation_text": "Celtic mythological parallel (385.25): the four swans of the Children of Lir, condemned by a jealous stepmother to wander the seas of Ireland for 900 years, echoing Mamalujo and the lovers.",
      "categories": [
        "children-of-lir",
        "celtic-mythology",
        "swans",
        "folklore"
      ],
      "cross_references": [
        "003.04",
        "385.05"
      ],
      "sources": [
        "Joyce, P.W. Old Celtic Romances. https://www.gutenberg.org/ebooks/34190"
      ],
      "contributors": [
        "joycean-scholar",
        "open-wake-editor"
      ]
    },
    {
      "id": "385.31-63e7",
      "line_number": 31,
      "target_phrase": "Ossian",
      "annotation_text": "Celtic/mythological figure \"Ossian\" on page 385 (\"Tristan and Isolde\"): invoking the ancient Fianna cycle and early Irish Christianity within the voyage of Tristan and Isolde observed by the Four Old Men as seagulls, Wagnerian chromatic motifs, King Mark's displacement. During the Age of Heroes (closing) phase, this mythic presence grounds the universal dream in Ireland's heroic past, linking Finn MacCool's giant body to the Dublin landscape.",
      "categories": [
        "irish-mythology",
        "celtic-lore",
        "folklore",
        "saints"
      ],
      "cross_references": [
        "003.04",
        "030.14",
        "080.05",
        "139.14"
      ],
      "sources": [
        "MacKillop, James. Dictionary of Celtic Mythology. https://www.oxfordreference.com",
        "Lady Gregory. Gods and Fighting Men. https://www.gutenberg.org/ebooks/14465",
        "O'Grady, Standish. Silva Gadelica. https://archive.org/details/silvagadelicaiix01ograuoft",
        "O'Hehir, Brendan. A Gaelic Lexicon for Finnegans Wake. https://archive.org/details/gaeliclexiconfor0000oheh"
      ],
      "contributors": [
        "joycean-scholar",
        "open-wake-editor"
      ]
    }
  ]
}
