{
  "schema_version": "1.0.0",
  "book": 4,
  "chapter": 1,
  "page_number": 605,
  "annotations": [
    {
      "id": "605.05-6432",
      "line_number": 5,
      "target_phrase": "Kevin",
      "annotation_text": "The eternal fraternal dialectic between opposing sons Shem the Penman (the introvert, rebel, artist) and Shaun the Post (the materialist, orator, politician), embodied in \"Kevin\".",
      "categories": [
        "twins",
        "shem-and-shaun",
        "brother-battle",
        "dialectic"
      ],
      "cross_references": [
        "003.01"
      ],
      "sources": [
        "Atherton, James S. The Books at the Wake. https://archive.org/details/booksatwake0000athe",
        "Kenner, Hugh. Dublin's Joyce. https://archive.org/details/dublinsjoyce0000kenn",
        "Norris, Margot. The Decentered Universe of Finnegans Wake. https://archive.org/details/decentereduniver0000norr"
      ],
      "contributors": [
        "joycean-scholar",
        "open-wake-editor"
      ]
    },
    {
      "id": "605.11-82c0",
      "line_number": 11,
      "target_phrase": "Kevin",
      "annotation_text": "The eternal fraternal dialectic between opposing sons Shem the Penman (the introvert, rebel, artist) and Shaun the Post (the materialist, orator, politician), embodied in \"Kevin\".",
      "categories": [
        "twins",
        "shem-and-shaun",
        "brother-battle",
        "dialectic"
      ],
      "cross_references": [
        "003.01"
      ],
      "sources": [
        "Atherton, James S. The Books at the Wake. https://archive.org/details/booksatwake0000athe",
        "Kenner, Hugh. Dublin's Joyce. https://archive.org/details/dublinsjoyce0000kenn",
        "Norris, Margot. The Decentered Universe of Finnegans Wake. https://archive.org/details/decentereduniver0000norr"
      ],
      "contributors": [
        "joycean-scholar",
        "open-wake-editor"
      ]
    },
    {
      "id": "605.15-1f05",
      "line_number": 15,
      "target_phrase": "Kevin",
      "annotation_text": "The eternal fraternal dialectic between opposing sons Shem the Penman (the introvert, rebel, artist) and Shaun the Post (the materialist, orator, politician), embodied in \"Kevin\".",
      "categories": [
        "twins",
        "shem-and-shaun",
        "brother-battle",
        "dialectic"
      ],
      "cross_references": [
        "003.01"
      ],
      "sources": [
        "Atherton, James S. The Books at the Wake. https://archive.org/details/booksatwake0000athe",
        "Kenner, Hugh. Dublin's Joyce. https://archive.org/details/dublinsjoyce0000kenn",
        "Norris, Margot. The Decentered Universe of Finnegans Wake. https://archive.org/details/decentereduniver0000norr"
      ],
      "contributors": [
        "joycean-scholar",
        "open-wake-editor"
      ]
    },
    {
      "id": "605.19-af27",
      "line_number": 19,
      "target_phrase": "Kevin",
      "annotation_text": "The eternal fraternal dialectic between opposing sons Shem the Penman (the introvert, rebel, artist) and Shaun the Post (the materialist, orator, politician), embodied in \"Kevin\".",
      "categories": [
        "twins",
        "shem-and-shaun",
        "brother-battle",
        "dialectic"
      ],
      "cross_references": [
        "003.01"
      ],
      "sources": [
        "Atherton, James S. The Books at the Wake. https://archive.org/details/booksatwake0000athe",
        "Kenner, Hugh. Dublin's Joyce. https://archive.org/details/dublinsjoyce0000kenn",
        "Norris, Margot. The Decentered Universe of Finnegans Wake. https://archive.org/details/decentereduniver0000norr"
      ],
      "contributors": [
        "joycean-scholar",
        "open-wake-editor"
      ]
    },
    {
      "id": "605.21-8451",
      "line_number": 21,
      "target_phrase": "Kevin",
      "annotation_text": "The eternal fraternal dialectic between opposing sons Shem the Penman (the introvert, rebel, artist) and Shaun the Post (the materialist, orator, politician), embodied in \"Kevin\".",
      "categories": [
        "twins",
        "shem-and-shaun",
        "brother-battle",
        "dialectic"
      ],
      "cross_references": [
        "003.01"
      ],
      "sources": [
        "Atherton, James S. The Books at the Wake. https://archive.org/details/booksatwake0000athe",
        "Kenner, Hugh. Dublin's Joyce. https://archive.org/details/dublinsjoyce0000kenn",
        "Norris, Margot. The Decentered Universe of Finnegans Wake. https://archive.org/details/decentereduniver0000norr"
      ],
      "contributors": [
        "joycean-scholar",
        "open-wake-editor"
      ]
    },
    {
      "id": "605.23-9fff",
      "line_number": 23,
      "target_phrase": "Kevin",
      "annotation_text": "The eternal fraternal dialectic between opposing sons Shem the Penman (the introvert, rebel, artist) and Shaun the Post (the materialist, orator, politician), embodied in \"Kevin\".",
      "categories": [
        "twins",
        "shem-and-shaun",
        "brother-battle",
        "dialectic"
      ],
      "cross_references": [
        "003.01"
      ],
      "sources": [
        "Atherton, James S. The Books at the Wake. https://archive.org/details/booksatwake0000athe",
        "Kenner, Hugh. Dublin's Joyce. https://archive.org/details/dublinsjoyce0000kenn",
        "Norris, Margot. The Decentered Universe of Finnegans Wake. https://archive.org/details/decentereduniver0000norr"
      ],
      "contributors": [
        "joycean-scholar",
        "open-wake-editor"
      ]
    },
    {
      "id": "605.24-1109",
      "line_number": 24,
      "target_phrase": "seven",
      "annotation_text": "Joyce's recurring mystical or structural number (seven): encoding cabalistic intervals, Viconian divisions, and historical Dublin dates.",
      "categories": [
        "numerology",
        "cabala",
        "leitmotif",
        "symbolism"
      ],
      "cross_references": [
        "003.01"
      ],
      "sources": [
        "Hart, Clive. Structure and Motif in Finnegans Wake. https://archive.org/details/structuremotifin0000hart",
        "McHugh, Roland. Annotations to Finnegans Wake. https://archive.org/details/annotationstofin0000mchu_h5g8",
        "Connor, Steven. James Joyce (Select Bibliography). https://archive.org/details/jamesjoyce0000conn"
      ],
      "contributors": [
        "joycean-scholar",
        "open-wake-editor"
      ]
    },
    {
      "id": "605.27-68b1",
      "line_number": 27,
      "target_phrase": "seven",
      "annotation_text": "Joyce's recurring mystical or structural number (seven): encoding cabalistic intervals, Viconian divisions, and historical Dublin dates.",
      "categories": [
        "numerology",
        "cabala",
        "leitmotif",
        "symbolism"
      ],
      "cross_references": [
        "003.01"
      ],
      "sources": [
        "Hart, Clive. Structure and Motif in Finnegans Wake. https://archive.org/details/structuremotifin0000hart",
        "McHugh, Roland. Annotations to Finnegans Wake. https://archive.org/details/annotationstofin0000mchu_h5g8",
        "Connor, Steven. James Joyce (Select Bibliography). https://archive.org/details/jamesjoyce0000conn"
      ],
      "contributors": [
        "joycean-scholar",
        "open-wake-editor"
      ]
    },
    {
      "id": "605.28-4d85",
      "line_number": 28,
      "target_phrase": "Kevin",
      "annotation_text": "The eternal fraternal dialectic between opposing sons Shem the Penman (the introvert, rebel, artist) and Shaun the Post (the materialist, orator, politician), embodied in \"Kevin\".",
      "categories": [
        "twins",
        "shem-and-shaun",
        "brother-battle",
        "dialectic"
      ],
      "cross_references": [
        "003.01"
      ],
      "sources": [
        "Atherton, James S. The Books at the Wake. https://archive.org/details/booksatwake0000athe",
        "Kenner, Hugh. Dublin's Joyce. https://archive.org/details/dublinsjoyce0000kenn",
        "Norris, Margot. The Decentered Universe of Finnegans Wake. https://archive.org/details/decentereduniver0000norr"
      ],
      "contributors": [
        "joycean-scholar",
        "open-wake-editor"
      ]
    },
    {
      "id": "605.31-beff",
      "line_number": 31,
      "target_phrase": "Kevin",
      "annotation_text": "The eternal fraternal dialectic between opposing sons Shem the Penman (the introvert, rebel, artist) and Shaun the Post (the materialist, orator, politician), embodied in \"Kevin\".",
      "categories": [
        "twins",
        "shem-and-shaun",
        "brother-battle",
        "dialectic"
      ],
      "cross_references": [
        "003.01"
      ],
      "sources": [
        "Atherton, James S. The Books at the Wake. https://archive.org/details/booksatwake0000athe",
        "Kenner, Hugh. Dublin's Joyce. https://archive.org/details/dublinsjoyce0000kenn",
        "Norris, Margot. The Decentered Universe of Finnegans Wake. https://archive.org/details/decentereduniver0000norr"
      ],
      "contributors": [
        "joycean-scholar",
        "open-wake-editor"
      ]
    }
  ]
}
