{
  "schema_version": "1.0.0",
  "book": 4,
  "chapter": 1,
  "page_number": 607,
  "annotations": [
    {
      "id": "607.06-a4ee",
      "line_number": 6,
      "target_phrase": "four",
      "annotation_text": "Joyce's recurring mystical or structural number (four): encoding cabalistic intervals, Viconian divisions, and historical Dublin dates.",
      "categories": [
        "numerology",
        "cabala",
        "leitmotif",
        "symbolism"
      ],
      "cross_references": [
        "003.01"
      ],
      "sources": [
        "Hart, Clive. Structure and Motif in Finnegans Wake. https://archive.org/details/structuremotifin0000hart",
        "McHugh, Roland. Annotations to Finnegans Wake. https://archive.org/details/annotationstofin0000mchu_h5g8",
        "Connor, Steven. James Joyce (Select Bibliography). https://archive.org/details/jamesjoyce0000conn"
      ],
      "contributors": [
        "joycean-scholar",
        "open-wake-editor"
      ]
    },
    {
      "id": "607.24-3578",
      "line_number": 24,
      "target_phrase": "Bar",
      "annotation_text": "The Twelve Jurors / Tavern Drinkers (Bar): representing the chorus of public opinion, the twelve signs of the Zodiac, the Apostles, and the customers gossiping in HCE's Chapelizod pub.",
      "categories": [
        "twelve-jurors",
        "pub-life",
        "chapelizod",
        "trial"
      ],
      "cross_references": [
        "003.01"
      ],
      "sources": [
        "Glasheen, Adaline. Third Census of Finnegans Wake. https://archive.org/details/thirdcensusoffin0000glas",
        "Campbell, Joseph and Robinson, Henry Morton. A Skeleton Key to Finnegans Wake. https://archive.org/details/skeletonkeytofin00camp"
      ],
      "contributors": [
        "joycean-scholar",
        "open-wake-editor"
      ]
    }
  ]
}
